dataset_code,layer_code,name,description,terrestrial,marine,freshwater,cellsize_equalarea,cellsize_lonlat,units,primary_type,primary_spatial_resolution,primary_source,start_year,start_month,start_day,end_year,end_month,end_day,derivation,month,is_surface,version
Bio-ORACLE,BO2_silicatemax_bdmean,Silicate concentration (maximum at mean depth),Maximum mole concentration of silicate in sea water at mean bottom depth,FALSE,TRUE,FALSE,7000,0.083333333,Â¾mol/m,Model,0.25 arcdegree,Global Ocean Biogeochemistry NON ASSIMILATIVE Hindcast (PISCES) URL: http://marine.copernicus.eu/,2000,NA,NA,2014,NA,NA,maximum value at mean bottom depth,NA,FALSE,2
Bio-ORACLE,BO2_silicatemax_bdmin,Silicate concentration (maximum at min depth),Maximum mole concentration of silicate in sea water at mean bottom depth,FALSE,TRUE,FALSE,7000,0.083333333,Â¾mol/m,Model,0.25 arcdegree,Global Ocean Biogeochemistry NON ASSIMILATIVE Hindcast (PISCES) URL: http://marine.copernicus.eu/,2000,NA,NA,2014,NA,NA,maximum value at minimum bottom depth,NA,FALSE,2
Bio-ORACLE,BO2_silicatemean_bdmax,Silicate concentration (mean at max depth),Mean mole concentration of silicate in sea water at maximum bottom depth,FALSE,TRUE,FALSE,7000,0.083333333,Â¾mol/m,Model,0.25 arcdegree,Global Ocean Biogeochemistry NON ASSIMILATIVE Hindcast (PISCES) URL: http://marine.copernicus.eu/,2000,NA,NA,2014,NA,NA,mean value at maximum bottom depth,NA,FALSE,2
Bio-ORACLE,BO2_silicatemean_bdmean,Silicate concentration (mean at mean depth),Mean mole concentration of silicate in sea water at mean bottom depth,FALSE,TRUE,FALSE,7000,0.083333333,Â¾mol/m,Model,0.25 arcdegree,Global Ocean Biogeochemistry NON ASSIMILATIVE Hindcast (PISCES) URL: http://marine.copernicus.eu/,2000,NA,NA,2014,NA,NA,mean value at mean bottom depth,NA,FALSE,2
Bio-ORACLE,BO2_silicatemean_bdmin,Silicate concentration (mean at min depth),Mean mole concentration of silicate in sea water at minimum bottom depth,FALSE,TRUE,FALSE,7000,0.083333333,Â¾mol/m,Model,0.25 arcdegree,Global Ocean Biogeochemistry NON ASSIMILATIVE Hindcast (PISCES) URL: http://marine.copernicus.eu/,2000,NA,NA,2014,NA,NA,mean value at minimum bottom depth,NA,FALSE,2
Bio-ORACLE,BO2_silicatemin_bdmax,Silicate concentration (minimum at max depth),Minimum mole concentration of silicate in sea water at maximum bottom depth,FALSE,TRUE,FALSE,7000,0.083333333,Â¾mol/m,Model,0.25 arcdegree,Global Ocean Biogeochemistry NON ASSIMILATIVE Hindcast (PISCES) URL: http://marine.copernicus.eu/,2000,NA,NA,2014,NA,NA,minimum value at maximum bottom depth,NA,FALSE,2
Bio-ORACLE,BO2_silicatemin_bdmean,Silicate concentration (minimum at mean depth),Minimum mole concentration of silicate in sea water at mean bottom depth,FALSE,TRUE,FALSE,7000,0.083333333,Â¾mol/m,Model,0.25 arcdegree,Global Ocean Biogeochemistry NON ASSIMILATIVE Hindcast (PISCES) URL: http://marine.copernicus.eu/,2000,NA,NA,2014,NA,NA,minimum value at mean bottom depth,NA,FALSE,2
Bio-ORACLE,BO2_silicatemin_bdmin,Silicate concentration (minimum at min depth),Minimum mole concentration of silicate in sea water at minimum bottom depth,FALSE,TRUE,FALSE,7000,0.083333333,Â¾mol/m,Model,0.25 arcdegree,Global Ocean Biogeochemistry NON ASSIMILATIVE Hindcast (PISCES) URL: http://marine.copernicus.eu/,2000,NA,NA,2014,NA,NA,minimum value at minimum bottom depth,NA,FALSE,2
Bio-ORACLE,BO2_silicaterange_bdmax,Silicate concentration (range at max depth),Range of the mole concentration of silicate in sea water at maximum bottom depth,FALSE,TRUE,FALSE,7000,0.083333333,Â¾mol/m,Model,0.25 arcdegree,Global Ocean Biogeochemistry NON ASSIMILATIVE Hindcast (PISCES) URL: http://marine.copernicus.eu/,2000,NA,NA,2014,NA,NA,range at maximum bottom depth,NA,FALSE,2
Bio-ORACLE,BO2_silicaterange_bdmean,Silicate concentration (range at mean depth),Range of the mole concentration of silicate in sea water at mean bottom depth,FALSE,TRUE,FALSE,7000,0.083333333,Â¾mol/m,Model,0.25 arcdegree,Global Ocean Biogeochemistry NON ASSIMILATIVE Hindcast (PISCES) URL: http://marine.copernicus.eu/,2000,NA,NA,2014,NA,NA,range at mean bottom depth,NA,FALSE,2
Bio-ORACLE,BO2_silicaterange_bdmin,Silicate concentration (range at min depth),Range of the mole concentration of silicate in sea water at minimum bottom depth,FALSE,TRUE,FALSE,7000,0.083333333,Â¾mol/m,Model,0.25 arcdegree,Global Ocean Biogeochemistry NON ASSIMILATIVE Hindcast (PISCES) URL: http://marine.copernicus.eu/,2000,NA,NA,2014,NA,NA,range at minimum bottom depth,NA,FALSE,2
Bio-ORACLE,BO2_silicateltmax_bdmax,Silicate concentration (longterm max at max depth),Longterm maximum mole concentration of silicate in sea water at maximum bottom depth,FALSE,TRUE,FALSE,7000,0.083333333,Â¾mol/m,Model,0.25 arcdegree,Global Ocean Biogeochemistry NON ASSIMILATIVE Hindcast (PISCES) URL: http://marine.copernicus.eu/,2000,NA,NA,2014,NA,NA,long term maximum value at maximum bottom depth,NA,FALSE,2
Bio-ORACLE,BO2_silicateltmax_bdmean,Silicate concentration (longterm max at mean depth),Longterm maximum mole concentration of silicate in sea water at mean bottom depth,FALSE,TRUE,FALSE,7000,0.083333333,Â¾mol/m,Model,0.25 arcdegree,Global Ocean Biogeochemistry NON ASSIMILATIVE Hindcast (PISCES) URL: http://marine.copernicus.eu/,2000,NA,NA,2014,NA,NA,long term maximum value at mean bottom depth,NA,FALSE,2
Bio-ORACLE,BO2_silicateltmax_bdmin,Silicate concentration (longterm max at min depth),Longterm maximum mole concentration of silicate in sea water at minimum bottom depth,FALSE,TRUE,FALSE,7000,0.083333333,Â¾mol/m,Model,0.25 arcdegree,Global Ocean Biogeochemistry NON ASSIMILATIVE Hindcast (PISCES) URL: http://marine.copernicus.eu/,2000,NA,NA,2014,NA,NA,long term maximum value at minimum bottom depth,NA,FALSE,2
Bio-ORACLE,BO2_silicateltmin_bdmax,Silicate concentration (longterm min at max depth),Longterm minimum mole concentration of silicate in sea water at maximum bottom depth,FALSE,TRUE,FALSE,7000,0.083333333,Â¾mol/m,Model,0.25 arcdegree,Global Ocean Biogeochemistry NON ASSIMILATIVE Hindcast (PISCES) URL: http://marine.copernicus.eu/,2000,NA,NA,2014,NA,NA,long term minimum value at maximum bottom depth,NA,FALSE,2
Bio-ORACLE,BO2_silicateltmin_bdmean,Silicate concentration (longterm max at mean depth),Longterm minimum mole concentration of silicate in sea water at mean bottom depth,FALSE,TRUE,FALSE,7000,0.083333333,Â¾mol/m,Model,0.25 arcdegree,Global Ocean Biogeochemistry NON ASSIMILATIVE Hindcast (PISCES) URL: http://marine.copernicus.eu/,2000,NA,NA,2014,NA,NA,long term minimum value at mean bottom depth,NA,FALSE,2
Bio-ORACLE,BO2_silicateltmin_bdmin,Silicate concentration (longterm min at min depth),Longterm minimum mole concentration of silicate in sea water at minimum bottom depth,FALSE,TRUE,FALSE,7000,0.083333333,Â¾mol/m,Model,0.25 arcdegree,Global Ocean Biogeochemistry NON ASSIMILATIVE Hindcast (PISCES) URL: http://marine.copernicus.eu/,2000,NA,NA,2014,NA,NA,long term minimum value at minimum bottom depth,NA,FALSE,2
Bio-ORACLE,BO2_icecoverltmax_ss,Sea ice concentration (longterm max),Longterm maximum sea ice concentration,FALSE,TRUE,FALSE,7000,0.083333333,fraction,Model,0.25 arcdegree,Global Ocean Physics Reanalysis ECMWF ORAP5.0 (1979-2013) URL: http://marine.copernicus.eu/,2000,NA,NA,2014,NA,NA,long term maximum,NA,TRUE,2
Bio-ORACLE,BO2_icecoverltmin_ss,Sea ice concentration (longterm min),Longterm minimum sea ice concentration,FALSE,TRUE,FALSE,7000,0.083333333,fraction,Model,0.25 arcdegree,Global Ocean Physics Reanalysis ECMWF ORAP5.0 (1979-2013) URL: http://marine.copernicus.eu/,2000,NA,NA,2014,NA,NA,long term minimum,NA,TRUE,2
Bio-ORACLE,BO2_icecovermax_ss,Sea ice concentration (maximum),Maximum sea ice concentration,FALSE,TRUE,FALSE,7000,0.083333333,fraction,Model,0.25 arcdegree,Global Ocean Physics Reanalysis ECMWF ORAP5.0 (1979-2013) URL: http://marine.copernicus.eu/,2000,NA,NA,2014,NA,NA,maximum,NA,TRUE,2
Bio-ORACLE,BO2_icecovermean_ss,Sea ice concentration (mean),Mean sea ice concentration,FALSE,TRUE,FALSE,7000,0.083333333,fraction,Model,0.25 arcdegree,Global Ocean Physics Reanalysis ECMWF ORAP5.0 (1979-2013) URL: http://marine.copernicus.eu/,2000,NA,NA,2014,NA,NA,mean,NA,TRUE,2
Bio-ORACLE,BO2_icecovermin_ss,Sea ice concentration (minimum),Minimum sea ice concentration,FALSE,TRUE,FALSE,7000,0.083333333,fraction,Model,0.25 arcdegree,Global Ocean Physics Reanalysis ECMWF ORAP5.0 (1979-2013) URL: http://marine.copernicus.eu/,2000,NA,NA,2014,NA,NA,min,NA,TRUE,2
Bio-ORACLE,BO2_icecoverrange_ss,Sea ice concentration (range),Range of sea ice concentration,FALSE,TRUE,FALSE,7000,0.083333333,fraction,Model,0.25 arcdegree,Global Ocean Physics Reanalysis ECMWF ORAP5.0 (1979-2013) URL: http://marine.copernicus.eu/,2000,NA,NA,2014,NA,NA,range,NA,TRUE,2
Bio-ORACLE,BO2_icethickltmax_ss,Sea ice thickness (longterm max),Longterm maximum sea ice thickness,FALSE,TRUE,FALSE,7000,0.083333333,m,Model,0.25 arcdegree,Global Ocean Physics Reanalysis ECMWF ORAP5.0 (1979-2013) URL: http://marine.copernicus.eu/,2000,NA,NA,2014,NA,NA,long term maximum,NA,TRUE,2
Bio-ORACLE,BO2_icethickltmin_ss,Sea ice thickness (longterm min),Longterm minimum sea ice thickness,FALSE,TRUE,FALSE,7000,0.083333333,m,Model,0.25 arcdegree,Global Ocean Physics Reanalysis ECMWF ORAP5.0 (1979-2013) URL: http://marine.copernicus.eu/,2000,NA,NA,2014,NA,NA,long term minimum,NA,TRUE,2
Bio-ORACLE,BO2_icethickmax_ss,Sea ice thickness (maximum),Maximum sea ice thickness,FALSE,TRUE,FALSE,7000,0.083333333,m,Model,0.25 arcdegree,Global Ocean Physics Reanalysis ECMWF ORAP5.0 (1979-2013) URL: http://marine.copernicus.eu/,2000,NA,NA,2014,NA,NA,maximum,NA,TRUE,2
Bio-ORACLE,BO2_icethickmean_ss,Sea ice thickness (mean),Mean sea ice thickness,FALSE,TRUE,FALSE,7000,0.083333333,m,Model,0.25 arcdegree,Global Ocean Physics Reanalysis ECMWF ORAP5.0 (1979-2013) URL: http://marine.copernicus.eu/,2000,NA,NA,2014,NA,NA,mean,NA,TRUE,2
Bio-ORACLE,BO2_icethickmin_ss,Sea ice thickness (minimum),Minimum sea ice thickness,FALSE,TRUE,FALSE,7000,0.083333333,m,Model,0.25 arcdegree,Global Ocean Physics Reanalysis ECMWF ORAP5.0 (1979-2013) URL: http://marine.copernicus.eu/,2000,NA,NA,2014,NA,NA,min,NA,TRUE,2
Bio-ORACLE,BO2_icethickrange_ss,Sea ice thickness (range),Range of sea ice thickness,FALSE,TRUE,FALSE,7000,0.083333333,m,Model,0.25 arcdegree,Global Ocean Physics Reanalysis ECMWF ORAP5.0 (1979-2013) URL: http://marine.copernicus.eu/,2000,NA,NA,2014,NA,NA,range,NA,TRUE,2
Bio-ORACLE,BO2_templtmax_ss,Sea surface temperature (longterm max),Longterm maximum sea surface temperature,FALSE,TRUE,FALSE,7000,0.083333333,degrees Celcius,Model,0.25 arcdegree,Global Ocean Physics Reanalysis ECMWF ORAP5.0 (1979-2013) URL: http://marine.copernicus.eu/,2000,NA,NA,2014,NA,NA,long term maximum,NA,TRUE,2
Bio-ORACLE,BO2_templtmin_ss,Sea surface temperature (longterm min),Longterm minimum sea surface temperature,FALSE,TRUE,FALSE,7000,0.083333333,degrees Celcius,Model,0.25 arcdegree,Global Ocean Physics Reanalysis ECMWF ORAP5.0 (1979-2013) URL: http://marine.copernicus.eu/,2000,NA,NA,2014,NA,NA,long term minimum,NA,TRUE,2
Bio-ORACLE,BO2_tempmax_ss,Sea surface temperature (maximum),Maximum sea surface temperature,FALSE,TRUE,FALSE,7000,0.083333333,degrees Celcius,Model,0.25 arcdegree,Global Ocean Physics Reanalysis ECMWF ORAP5.0 (1979-2013) URL: http://marine.copernicus.eu/,2000,NA,NA,2014,NA,NA,maximum,NA,TRUE,2
Bio-ORACLE,BO2_tempmean_ss,Sea surface temperature (mean),Mean sea surface temperature,FALSE,TRUE,FALSE,7000,0.083333333,degrees Celcius,Model,0.25 arcdegree,Global Ocean Physics Reanalysis ECMWF ORAP5.0 (1979-2013) URL: http://marine.copernicus.eu/,2000,NA,NA,2014,NA,NA,mean,NA,TRUE,2
Bio-ORACLE,BO2_tempmin_ss,Sea surface temperature (minimum),Minimum sea surface temperature,FALSE,TRUE,FALSE,7000,0.083333333,degrees Celcius,Model,0.25 arcdegree,Global Ocean Physics Reanalysis ECMWF ORAP5.0 (1979-2013) URL: http://marine.copernicus.eu/,2000,NA,NA,2014,NA,NA,min,NA,TRUE,2
Bio-ORACLE,BO2_temprange_ss,Sea surface temperature (range),Range of sea surface temperature,FALSE,TRUE,FALSE,7000,0.083333333,degrees Celcius,Model,0.25 arcdegree,Global Ocean Physics Reanalysis ECMWF ORAP5.0 (1979-2013) URL: http://marine.copernicus.eu/,2000,NA,NA,2014,NA,NA,range,NA,TRUE,2
Bio-ORACLE,BO2_chlomax_ss,Chlorophyll concentration (maximum),Maximum mass concentration of chlorophyll at the sea surface,FALSE,TRUE,FALSE,7000,0.083333333,mg/mÅ,Model,0.25 arcdegree,Global Ocean Biogeochemistry NON ASSIMILATIVE Hindcast (PISCES) URL: http://marine.copernicus.eu/,2000,NA,NA,2014,NA,NA,maximum value at sea surface,NA,TRUE,2
Bio-ORACLE,BO2_chlomean_ss,Chlorophyll concentration (mean),Mean mass concentration of chlorophyll at the sea surface,FALSE,TRUE,FALSE,7000,0.083333333,mg/mÅ,Model,0.25 arcdegree,Global Ocean Biogeochemistry NON ASSIMILATIVE Hindcast (PISCES) URL: http://marine.copernicus.eu/,2000,NA,NA,2014,NA,NA,mean value at sea surface,NA,TRUE,2
Bio-ORACLE,BO2_chlomin_ss,Chlorophyll concentration (minimum),Minimum mass concentration of chlorophyll at the sea surface,FALSE,TRUE,FALSE,7000,0.083333333,mg/mÅ,Model,0.25 arcdegree,Global Ocean Biogeochemistry NON ASSIMILATIVE Hindcast (PISCES) URL: http://marine.copernicus.eu/,2000,NA,NA,2014,NA,NA,minimum value at sea surface,NA,TRUE,2
Bio-ORACLE,BO2_chlorange_ss,Chlorophyll concentration (range),Range of mass concentration of chlorophyll at the sea surface,FALSE,TRUE,FALSE,7000,0.083333333,mg/mÅ,Model,0.25 arcdegree,Global Ocean Biogeochemistry NON ASSIMILATIVE Hindcast (PISCES) URL: http://marine.copernicus.eu/,2000,NA,NA,2014,NA,NA,range at sea surface,NA,TRUE,2
Bio-ORACLE,BO2_chloltmax_ss,Chlorophyll concentration (longterm max),Longterm maximum mass concentration of chlorophyll at the sea surface,FALSE,TRUE,FALSE,7000,0.083333333,mg/mÅ,Model,0.25 arcdegree,Global Ocean Biogeochemistry NON ASSIMILATIVE Hindcast (PISCES) URL: http://marine.copernicus.eu/,2000,NA,NA,2014,NA,NA,long term maximum value at sea surface,NA,TRUE,2
Bio-ORACLE,BO2_chloltmin_ss,Chlorophyll concentration (longterm min),Longterm minimum mass concentration of chlorophyll at the sea surface,FALSE,TRUE,FALSE,7000,0.083333333,mg/mÅ,Model,0.25 arcdegree,Global Ocean Biogeochemistry NON ASSIMILATIVE Hindcast (PISCES) URL: http://marine.copernicus.eu/,2000,NA,NA,2014,NA,NA,long term minimum value at sea surface,NA,TRUE,2
Bio-ORACLE,BO2_curvelmax_ss,Current velocity (maximum),Maximum surface current velocity,FALSE,TRUE,FALSE,7000,0.083333333,m/s,Model,0.25 arcdegree,Global Ocean Physics Reanalysis ECMWF ORAP5.0 (1979-2013) URL: http://marine.copernicus.eu/,2000,NA,NA,2014,NA,NA,maximum value at sea surface,NA,TRUE,2
Bio-ORACLE,BO2_curvelmean_ss,Current velocity (mean),Mean surface current velocity,FALSE,TRUE,FALSE,7000,0.083333333,m/s,Model,0.25 arcdegree,Global Ocean Physics Reanalysis ECMWF ORAP5.0 (1979-2013) URL: http://marine.copernicus.eu/,2000,NA,NA,2014,NA,NA,mean value at sea surface,NA,TRUE,2
Bio-ORACLE,BO2_curvelmin_ss,Current velocity (minimum),Minimum surface current velocity,FALSE,TRUE,FALSE,7000,0.083333333,m/s,Model,0.25 arcdegree,Global Ocean Physics Reanalysis ECMWF ORAP5.0 (1979-2013) URL: http://marine.copernicus.eu/,2000,NA,NA,2014,NA,NA,minimum value at sea surface,NA,TRUE,2
Bio-ORACLE,BO2_curvelrange_ss,Current velocity (range),Range of surface current velocity,FALSE,TRUE,FALSE,7000,0.083333333,m/s,Model,0.25 arcdegree,Global Ocean Physics Reanalysis ECMWF ORAP5.0 (1979-2013) URL: http://marine.copernicus.eu/,2000,NA,NA,2014,NA,NA,range at sea surface,NA,TRUE,2
Bio-ORACLE,BO2_curvelltmax_ss,Current velocity (longterm max),Longterm maximum surface current velocity,FALSE,TRUE,FALSE,7000,0.083333333,m/s,Model,0.25 arcdegree,Global Ocean Physics Reanalysis ECMWF ORAP5.0 (1979-2013) URL: http://marine.copernicus.eu/,2000,NA,NA,2014,NA,NA,long term maximum value at sea surface,NA,TRUE,2
Bio-ORACLE,BO2_curvelltmin_ss,Current velocity (longterm min),Longterm minimum surface current velocity,FALSE,TRUE,FALSE,7000,0.083333333,m/s,Model,0.25 arcdegree,Global Ocean Physics Reanalysis ECMWF ORAP5.0 (1979-2013) URL: http://marine.copernicus.eu/,2000,NA,NA,2014,NA,NA,long term minimum value at sea surface,NA,TRUE,2
Bio-ORACLE,BO2_dissoxmax_ss,Dissolved oxygen concentration (maximum),Maximum dissolved oxygen concentration,FALSE,TRUE,FALSE,7000,0.083333333,Â¾mol/m,Model,0.25 arcdegree,Global Ocean Biogeochemistry NON ASSIMILATIVE Hindcast (PISCES) URL: http://marine.copernicus.eu/,2000,NA,NA,2014,NA,NA,maximum value at sea surface,NA,TRUE,2
Bio-ORACLE,BO2_dissoxmean_ss,Dissolved oxygen concentration (mean),Mean dissolved oxygen concentration,FALSE,TRUE,FALSE,7000,0.083333333,Â¾mol/m,Model,0.25 arcdegree,Global Ocean Biogeochemistry NON ASSIMILATIVE Hindcast (PISCES) URL: http://marine.copernicus.eu/,2000,NA,NA,2014,NA,NA,mean value at sea surface,NA,TRUE,2
Bio-ORACLE,BO2_dissoxmin_ss,Dissolved oxygen concentration (minimum),Minimum dissolved oxygen concentration,FALSE,TRUE,FALSE,7000,0.083333333,Â¾mol/m,Model,0.25 arcdegree,Global Ocean Biogeochemistry NON ASSIMILATIVE Hindcast (PISCES) URL: http://marine.copernicus.eu/,2000,NA,NA,2014,NA,NA,minimum value at sea surface,NA,TRUE,2
Bio-ORACLE,BO2_dissoxrange_ss,Dissolved oxygen concentration (range),Range of dissolved oxygen concentration,FALSE,TRUE,FALSE,7000,0.083333333,Â¾mol/m,Model,0.25 arcdegree,Global Ocean Biogeochemistry NON ASSIMILATIVE Hindcast (PISCES) URL: http://marine.copernicus.eu/,2000,NA,NA,2014,NA,NA,range at sea surface,NA,TRUE,2
Bio-ORACLE,BO2_dissoxltmax_ss,Dissolved oxygen concentration (longterm max),Longterm maximum dissolved oxygen concentration,FALSE,TRUE,FALSE,7000,0.083333333,Â¾mol/m,Model,0.25 arcdegree,Global Ocean Biogeochemistry NON ASSIMILATIVE Hindcast (PISCES) URL: http://marine.copernicus.eu/,2000,NA,NA,2014,NA,NA,long term maximum value at sea surface,NA,TRUE,2
Bio-ORACLE,BO2_dissoxltmin_ss,Dissolved oxygen concentration (longterm min),Longterm minimum dissolved oxygen concentration,FALSE,TRUE,FALSE,7000,0.083333333,Â¾mol/m,Model,0.25 arcdegree,Global Ocean Biogeochemistry NON ASSIMILATIVE Hindcast (PISCES) URL: http://marine.copernicus.eu/,2000,NA,NA,2014,NA,NA,long term minimum value at sea surface,NA,TRUE,2
Bio-ORACLE,BO2_ironmax_ss,Iron concentration (maximum),Maximum mole concentration of dissolved iron at the sea surface,FALSE,TRUE,FALSE,7000,0.083333333,Â¾mol/m,Model,0.25 arcdegree,Global Ocean Biogeochemistry NON ASSIMILATIVE Hindcast (PISCES) URL: http://marine.copernicus.eu/,2000,NA,NA,2014,NA,NA,maximum value at sea surface,NA,TRUE,2
Bio-ORACLE,BO2_ironmean_ss,Iron concentration (mean),Mean mole concentration of dissolved iron at the sea surface,FALSE,TRUE,FALSE,7000,0.083333333,Â¾mol/m,Model,0.25 arcdegree,Global Ocean Biogeochemistry NON ASSIMILATIVE Hindcast (PISCES) URL: http://marine.copernicus.eu/,2000,NA,NA,2014,NA,NA,mean value at sea surface,NA,TRUE,2
Bio-ORACLE,BO2_ironmin_ss,Iron concentration (minimum),Minimum mole concentration of dissolved iron at the sea surface,FALSE,TRUE,FALSE,7000,0.083333333,Â¾mol/m,Model,0.25 arcdegree,Global Ocean Biogeochemistry NON ASSIMILATIVE Hindcast (PISCES) URL: http://marine.copernicus.eu/,2000,NA,NA,2014,NA,NA,minimum value at sea surface,NA,TRUE,2
Bio-ORACLE,BO2_ironrange_ss,Iron concentration (range),Range of mole concentration of dissolved iron at the sea surface,FALSE,TRUE,FALSE,7000,0.083333333,Â¾mol/m,Model,0.25 arcdegree,Global Ocean Biogeochemistry NON ASSIMILATIVE Hindcast (PISCES) URL: http://marine.copernicus.eu/,2000,NA,NA,2014,NA,NA,range at sea surface,NA,TRUE,2
Bio-ORACLE,BO2_ironltmax_ss,Iron concentration (longterm max),Longterm maximum mole concentration of dissolved iron at the sea surface,FALSE,TRUE,FALSE,7000,0.083333333,Â¾mol/m,Model,0.25 arcdegree,Global Ocean Biogeochemistry NON ASSIMILATIVE Hindcast (PISCES) URL: http://marine.copernicus.eu/,2000,NA,NA,2014,NA,NA,long term maximum value at sea surface,NA,TRUE,2
Bio-ORACLE,BO2_ironltmin_ss,Iron concentration (longterm min),Longterm minimum mole concentration of dissolved iron at the sea surface,FALSE,TRUE,FALSE,7000,0.083333333,Â¾mol/m,Model,0.25 arcdegree,Global Ocean Biogeochemistry NON ASSIMILATIVE Hindcast (PISCES) URL: http://marine.copernicus.eu/,2000,NA,NA,2014,NA,NA,long term minimum value at sea surface,NA,TRUE,2
Bio-ORACLE,BO2_phosphatemax_ss,Phosphate concentration (maximum),Maximum mole concentration of phosphate at the sea surface,FALSE,TRUE,FALSE,7000,0.083333333,Â¾mol/m,Model,0.25 arcdegree,Global Ocean Biogeochemistry NON ASSIMILATIVE Hindcast (PISCES) URL: http://marine.copernicus.eu/,2000,NA,NA,2014,NA,NA,maximum value at sea surface,NA,TRUE,2
Bio-ORACLE,BO2_phosphatemean_ss,Phosphate concentration (mean),Mean mole concentration of phosphate at the sea surface,FALSE,TRUE,FALSE,7000,0.083333333,Â¾mol/m,Model,0.25 arcdegree,Global Ocean Biogeochemistry NON ASSIMILATIVE Hindcast (PISCES) URL: http://marine.copernicus.eu/,2000,NA,NA,2014,NA,NA,mean value at sea surface,NA,TRUE,2
Bio-ORACLE,BO2_phosphatemin_ss,Phosphate concentration (minimum),Minimum mole concentration of phosphate at the sea surface,FALSE,TRUE,FALSE,7000,0.083333333,Â¾mol/m,Model,0.25 arcdegree,Global Ocean Biogeochemistry NON ASSIMILATIVE Hindcast (PISCES) URL: http://marine.copernicus.eu/,2000,NA,NA,2014,NA,NA,minimum value at sea surface,NA,TRUE,2
Bio-ORACLE,BO2_phosphaterange_ss,Phosphate concentration (range),Range of mole concentration of phosphate at the sea surface,FALSE,TRUE,FALSE,7000,0.083333333,Â¾mol/m,Model,0.25 arcdegree,Global Ocean Biogeochemistry NON ASSIMILATIVE Hindcast (PISCES) URL: http://marine.copernicus.eu/,2000,NA,NA,2014,NA,NA,range at sea surface,NA,TRUE,2
Bio-ORACLE,BO2_phosphateltmax_ss,Phosphate concentration (longterm max),Longterm maximum mole concentration of phosphate at the sea surface,FALSE,TRUE,FALSE,7000,0.083333333,Â¾mol/m,Model,0.25 arcdegree,Global Ocean Biogeochemistry NON ASSIMILATIVE Hindcast (PISCES) URL: http://marine.copernicus.eu/,2000,NA,NA,2014,NA,NA,long term maximum value at sea surface,NA,TRUE,2
Bio-ORACLE,BO2_phosphateltmin_ss,Phosphate concentration (longterm min),Longterm minimum mole concentration of phosphate at the sea surface,FALSE,TRUE,FALSE,7000,0.083333333,Â¾mol/m,Model,0.25 arcdegree,Global Ocean Biogeochemistry NON ASSIMILATIVE Hindcast (PISCES) URL: http://marine.copernicus.eu/,2000,NA,NA,2014,NA,NA,long term minimum value at sea surface,NA,TRUE,2
Bio-ORACLE,BO2_nitratemax_ss,Nitrate concentration (maximum),Maximum mole concentration of nitrate at the sea surface,FALSE,TRUE,FALSE,7000,0.083333333,Â¾mol/m,Model,0.25 arcdegree,Global Ocean Biogeochemistry NON ASSIMILATIVE Hindcast (PISCES) URL: http://marine.copernicus.eu/,2000,NA,NA,2014,NA,NA,maximum value at sea surface,NA,TRUE,2
Bio-ORACLE,BO2_nitratemean_ss,Nitrate concentration (mean),Mean mole concentration of nitrate at the sea surface,FALSE,TRUE,FALSE,7000,0.083333333,Â¾mol/m,Model,0.25 arcdegree,Global Ocean Biogeochemistry NON ASSIMILATIVE Hindcast (PISCES) URL: http://marine.copernicus.eu/,2000,NA,NA,2014,NA,NA,mean value at sea surface,NA,TRUE,2
Bio-ORACLE,BO2_nitratemin_ss,Nitrate concentration (minimum),Minimum mole concentration of nitrate at the sea surface,FALSE,TRUE,FALSE,7000,0.083333333,Â¾mol/m,Model,0.25 arcdegree,Global Ocean Biogeochemistry NON ASSIMILATIVE Hindcast (PISCES) URL: http://marine.copernicus.eu/,2000,NA,NA,2014,NA,NA,minimum value at sea surface,NA,TRUE,2
Bio-ORACLE,BO2_nitraterange_ss,Nitrate concentration (range),Range of mole concentration of nitrate at the sea surface,FALSE,TRUE,FALSE,7000,0.083333333,Â¾mol/m,Model,0.25 arcdegree,Global Ocean Biogeochemistry NON ASSIMILATIVE Hindcast (PISCES) URL: http://marine.copernicus.eu/,2000,NA,NA,2014,NA,NA,range at sea surface,NA,TRUE,2
Bio-ORACLE,BO2_nitrateltmax_ss,Nitrate concentration (longterm max),Longterm maximum mole concentration of nitrate at the sea surface,FALSE,TRUE,FALSE,7000,0.083333333,Â¾mol/m,Model,0.25 arcdegree,Global Ocean Biogeochemistry NON ASSIMILATIVE Hindcast (PISCES) URL: http://marine.copernicus.eu/,2000,NA,NA,2014,NA,NA,long term maximum value at sea surface,NA,TRUE,2
Bio-ORACLE,BO2_nitrateltmin_ss,Nitrate concentration (longterm min),Longterm minimum mole concentration of nitrate at the sea surface,FALSE,TRUE,FALSE,7000,0.083333333,Â¾mol/m,Model,0.25 arcdegree,Global Ocean Biogeochemistry NON ASSIMILATIVE Hindcast (PISCES) URL: http://marine.copernicus.eu/,2000,NA,NA,2014,NA,NA,long term minimum value at sea surface,NA,TRUE,2
Bio-ORACLE,BO2_carbonphytomax_ss,Carbon phytoplankton biomass (maximum),Maximum mole concentration of phytoplankton expressed as carbon at the sea surface,FALSE,TRUE,FALSE,7000,0.083333333,Â¾mol/m,Model,0.25 arcdegree,Global Ocean Biogeochemistry NON ASSIMILATIVE Hindcast (PISCES) URL: http://marine.copernicus.eu/,2000,NA,NA,2014,NA,NA,maximum value at sea surface,NA,TRUE,2
Bio-ORACLE,BO2_carbonphytomean_ss,Carbon phytoplankton biomass (mean),Mean mole concentration of phytoplankton expressed as carbon at the sea surface,FALSE,TRUE,FALSE,7000,0.083333333,Â¾mol/m,Model,0.25 arcdegree,Global Ocean Biogeochemistry NON ASSIMILATIVE Hindcast (PISCES) URL: http://marine.copernicus.eu/,2000,NA,NA,2014,NA,NA,mean value at sea surface,NA,TRUE,2
Bio-ORACLE,BO2_carbonphytomin_ss,Carbon phytoplankton biomass (minimum),Minimum mole concentration of phytoplankton expressed as carbon at the sea surface,FALSE,TRUE,FALSE,7000,0.083333333,Â¾mol/m,Model,0.25 arcdegree,Global Ocean Biogeochemistry NON ASSIMILATIVE Hindcast (PISCES) URL: http://marine.copernicus.eu/,2000,NA,NA,2014,NA,NA,minimum value at sea surface,NA,TRUE,2
