dataset_code,layer_code,name,description,terrestrial,marine,freshwater,cellsize_equalarea,cellsize_lonlat,units,primary_type,primary_spatial_resolution,primary_source,start_year,start_month,start_day,end_year,end_month,end_day,derivation,month,is_surface,version
Bio-ORACLE,BO2_ironltmax_bdmax,Iron concentration (longterm max at max depth),Longterm maximum mole concentration of dissolved iron in sea water at maximum bottom depth,FALSE,TRUE,FALSE,7000,0.083333333,Â¾mol/m,Model,0.25 arcdegree,Global Ocean Biogeochemistry NON ASSIMILATIVE Hindcast (PISCES) URL: http://marine.copernicus.eu/,2000,NA,NA,2014,NA,NA,long term maximum value at maximum bottom depth,NA,FALSE,2
Bio-ORACLE,BO2_ironltmax_bdmean,Iron concentration (longterm max at mean depth),Longterm maximum mole concentration of dissolved iron in sea water at mean bottom depth,FALSE,TRUE,FALSE,7000,0.083333333,Â¾mol/m,Model,0.25 arcdegree,Global Ocean Biogeochemistry NON ASSIMILATIVE Hindcast (PISCES) URL: http://marine.copernicus.eu/,2000,NA,NA,2014,NA,NA,long term maximum value at mean bottom depth,NA,FALSE,2
Bio-ORACLE,BO2_ironltmax_bdmin,Iron concentration (longterm max at min depth),Longterm maximum mole concentration of dissolved iron in sea water at minimum bottom depth,FALSE,TRUE,FALSE,7000,0.083333333,Â¾mol/m,Model,0.25 arcdegree,Global Ocean Biogeochemistry NON ASSIMILATIVE Hindcast (PISCES) URL: http://marine.copernicus.eu/,2000,NA,NA,2014,NA,NA,long term maximum value at minimum bottom depth,NA,FALSE,2
Bio-ORACLE,BO2_ironltmin_bdmax,Iron concentration (longterm min at max depth),Longterm minimum mole concentration of dissolved iron in sea water at maximum bottom depth,FALSE,TRUE,FALSE,7000,0.083333333,Â¾mol/m,Model,0.25 arcdegree,Global Ocean Biogeochemistry NON ASSIMILATIVE Hindcast (PISCES) URL: http://marine.copernicus.eu/,2000,NA,NA,2014,NA,NA,long term minimum value at maximum bottom depth,NA,FALSE,2
Bio-ORACLE,BO2_ironltmin_bdmean,Iron concentration (longterm max at mean depth),Longterm minimum mole concentration of dissolved iron in sea water at mean bottom depth,FALSE,TRUE,FALSE,7000,0.083333333,Â¾mol/m,Model,0.25 arcdegree,Global Ocean Biogeochemistry NON ASSIMILATIVE Hindcast (PISCES) URL: http://marine.copernicus.eu/,2000,NA,NA,2014,NA,NA,long term minimum value at mean bottom depth,NA,FALSE,2
Bio-ORACLE,BO2_ironltmin_bdmin,Iron concentration (longterm min at min depth),Longterm minimum mole concentration of dissolved iron in sea water at minimum bottom depth,FALSE,TRUE,FALSE,7000,0.083333333,Â¾mol/m,Model,0.25 arcdegree,Global Ocean Biogeochemistry NON ASSIMILATIVE Hindcast (PISCES) URL: http://marine.copernicus.eu/,2000,NA,NA,2014,NA,NA,long term minimum value at minimum bottom depth,NA,FALSE,2
Bio-ORACLE,BO2_phosphatemax_bdmax,Phosphate concentration (maximum at max depth),Maximum mole concentration of phosphate in sea water at maximum bottom depth,FALSE,TRUE,FALSE,7000,0.083333333,Â¾mol/m,Model,0.25 arcdegree,Global Ocean Biogeochemistry NON ASSIMILATIVE Hindcast (PISCES) URL: http://marine.copernicus.eu/,2000,NA,NA,2014,NA,NA,maximum value at maximum bottom depth,NA,FALSE,2
Bio-ORACLE,BO2_phosphatemax_bdmean,Phosphate concentration (maximum at mean depth),Maximum mole concentration of phosphate in sea water at mean bottom depth,FALSE,TRUE,FALSE,7000,0.083333333,Â¾mol/m,Model,0.25 arcdegree,Global Ocean Biogeochemistry NON ASSIMILATIVE Hindcast (PISCES) URL: http://marine.copernicus.eu/,2000,NA,NA,2014,NA,NA,maximum value at mean bottom depth,NA,FALSE,2
Bio-ORACLE,BO2_phosphatemax_bdmin,Phosphate concentration (maximum at min depth),Maximum mole concentration of phosphate in sea water at mean bottom depth,FALSE,TRUE,FALSE,7000,0.083333333,Â¾mol/m,Model,0.25 arcdegree,Global Ocean Biogeochemistry NON ASSIMILATIVE Hindcast (PISCES) URL: http://marine.copernicus.eu/,2000,NA,NA,2014,NA,NA,maximum value at minimum bottom depth,NA,FALSE,2
Bio-ORACLE,BO2_phosphatemean_bdmax,Phosphate concentration (mean at max depth),Mean mole concentration of phosphate in sea water at maximum bottom depth,FALSE,TRUE,FALSE,7000,0.083333333,Â¾mol/m,Model,0.25 arcdegree,Global Ocean Biogeochemistry NON ASSIMILATIVE Hindcast (PISCES) URL: http://marine.copernicus.eu/,2000,NA,NA,2014,NA,NA,mean value at maximum bottom depth,NA,FALSE,2
Bio-ORACLE,BO2_phosphatemean_bdmean,Phosphate concentration (mean at mean depth),Mean mole concentration of phosphate in sea water at mean bottom depth,FALSE,TRUE,FALSE,7000,0.083333333,Â¾mol/m,Model,0.25 arcdegree,Global Ocean Biogeochemistry NON ASSIMILATIVE Hindcast (PISCES) URL: http://marine.copernicus.eu/,2000,NA,NA,2014,NA,NA,mean value at mean bottom depth,NA,FALSE,2
Bio-ORACLE,BO2_phosphatemean_bdmin,Phosphate concentration (mean at min depth),Mean mole concentration of phosphate in sea water at minimum bottom depth,FALSE,TRUE,FALSE,7000,0.083333333,Â¾mol/m,Model,0.25 arcdegree,Global Ocean Biogeochemistry NON ASSIMILATIVE Hindcast (PISCES) URL: http://marine.copernicus.eu/,2000,NA,NA,2014,NA,NA,mean value at minimum bottom depth,NA,FALSE,2
Bio-ORACLE,BO2_phosphatemin_bdmax,Phosphate concentration (minimum at max depth),Minimum mole concentration of phosphate in sea water at maximum bottom depth,FALSE,TRUE,FALSE,7000,0.083333333,Â¾mol/m,Model,0.25 arcdegree,Global Ocean Biogeochemistry NON ASSIMILATIVE Hindcast (PISCES) URL: http://marine.copernicus.eu/,2000,NA,NA,2014,NA,NA,minimum value at maximum bottom depth,NA,FALSE,2
Bio-ORACLE,BO2_phosphatemin_bdmean,Phosphate concentration (minimum at mean depth),Minimum mole concentration of phosphate in sea water at mean bottom depth,FALSE,TRUE,FALSE,7000,0.083333333,Â¾mol/m,Model,0.25 arcdegree,Global Ocean Biogeochemistry NON ASSIMILATIVE Hindcast (PISCES) URL: http://marine.copernicus.eu/,2000,NA,NA,2014,NA,NA,minimum value at mean bottom depth,NA,FALSE,2
Bio-ORACLE,BO2_phosphatemin_bdmin,Phosphate concentration (minimum at min depth),Minimum mole concentration of phosphate in sea water at minimum bottom depth,FALSE,TRUE,FALSE,7000,0.083333333,Â¾mol/m,Model,0.25 arcdegree,Global Ocean Biogeochemistry NON ASSIMILATIVE Hindcast (PISCES) URL: http://marine.copernicus.eu/,2000,NA,NA,2014,NA,NA,minimum value at minimum bottom depth,NA,FALSE,2
Bio-ORACLE,BO2_phosphaterange_bdmax,Phosphate concentration (range at max depth),Range of the mole concentration of phosphate in sea water at maximum bottom depth,FALSE,TRUE,FALSE,7000,0.083333333,Â¾mol/m,Model,0.25 arcdegree,Global Ocean Biogeochemistry NON ASSIMILATIVE Hindcast (PISCES) URL: http://marine.copernicus.eu/,2000,NA,NA,2014,NA,NA,range at maximum bottom depth,NA,FALSE,2
Bio-ORACLE,BO2_phosphaterange_bdmean,Phosphate concentration (range at mean depth),Range of the mole concentration of phosphate in sea water at mean bottom depth,FALSE,TRUE,FALSE,7000,0.083333333,Â¾mol/m,Model,0.25 arcdegree,Global Ocean Biogeochemistry NON ASSIMILATIVE Hindcast (PISCES) URL: http://marine.copernicus.eu/,2000,NA,NA,2014,NA,NA,range at mean bottom depth,NA,FALSE,2
Bio-ORACLE,BO2_phosphaterange_bdmin,Phosphate concentration (range at min depth),Range of the mole concentration of phosphate in sea water at minimum bottom depth,FALSE,TRUE,FALSE,7000,0.083333333,Â¾mol/m,Model,0.25 arcdegree,Global Ocean Biogeochemistry NON ASSIMILATIVE Hindcast (PISCES) URL: http://marine.copernicus.eu/,2000,NA,NA,2014,NA,NA,range at minimum bottom depth,NA,FALSE,2
Bio-ORACLE,BO2_phosphateltmax_bdmax,Phosphate concentration (longterm max at max depth),Longterm maximum mole concentration of phosphate in sea water at maximum bottom depth,FALSE,TRUE,FALSE,7000,0.083333333,Â¾mol/m,Model,0.25 arcdegree,Global Ocean Biogeochemistry NON ASSIMILATIVE Hindcast (PISCES) URL: http://marine.copernicus.eu/,2000,NA,NA,2014,NA,NA,long term maximum value at maximum bottom depth,NA,FALSE,2
Bio-ORACLE,BO2_phosphateltmax_bdmean,Phosphate concentration (longterm max at mean depth),Longterm maximum mole concentration of phosphate in sea water at mean bottom depth,FALSE,TRUE,FALSE,7000,0.083333333,Â¾mol/m,Model,0.25 arcdegree,Global Ocean Biogeochemistry NON ASSIMILATIVE Hindcast (PISCES) URL: http://marine.copernicus.eu/,2000,NA,NA,2014,NA,NA,long term maximum value at mean bottom depth,NA,FALSE,2
Bio-ORACLE,BO2_phosphateltmax_bdmin,Phosphate concentration (longterm max at min depth),Longterm maximum mole concentration of phosphate in sea water at minimum bottom depth,FALSE,TRUE,FALSE,7000,0.083333333,Â¾mol/m,Model,0.25 arcdegree,Global Ocean Biogeochemistry NON ASSIMILATIVE Hindcast (PISCES) URL: http://marine.copernicus.eu/,2000,NA,NA,2014,NA,NA,long term maximum value at minimum bottom depth,NA,FALSE,2
Bio-ORACLE,BO2_phosphateltmin_bdmax,Phosphate concentration (longterm min at max depth),Longterm minimum mole concentration of phosphate in sea water at maximum bottom depth,FALSE,TRUE,FALSE,7000,0.083333333,Â¾mol/m,Model,0.25 arcdegree,Global Ocean Biogeochemistry NON ASSIMILATIVE Hindcast (PISCES) URL: http://marine.copernicus.eu/,2000,NA,NA,2014,NA,NA,long term minimum value at maximum bottom depth,NA,FALSE,2
Bio-ORACLE,BO2_phosphateltmin_bdmean,Phosphate concentration (longterm max at mean depth),Longterm minimum mole concentration of phosphate in sea water at mean bottom depth,FALSE,TRUE,FALSE,7000,0.083333333,Â¾mol/m,Model,0.25 arcdegree,Global Ocean Biogeochemistry NON ASSIMILATIVE Hindcast (PISCES) URL: http://marine.copernicus.eu/,2000,NA,NA,2014,NA,NA,long term minimum value at mean bottom depth,NA,FALSE,2
Bio-ORACLE,BO2_phosphateltmin_bdmin,Phosphate concentration (longterm min at min depth),Longterm minimum mole concentration of phosphate in sea water at minimum bottom depth,FALSE,TRUE,FALSE,7000,0.083333333,Â¾mol/m,Model,0.25 arcdegree,Global Ocean Biogeochemistry NON ASSIMILATIVE Hindcast (PISCES) URL: http://marine.copernicus.eu/,2000,NA,NA,2014,NA,NA,long term minimum value at minimum bottom depth,NA,FALSE,2
Bio-ORACLE,BO2_lightbotmax_bdmax,Light at bottom (maximum at max depth),Maximum light penetration in the ocean at maximum bottom depth,FALSE,TRUE,FALSE,7000,0.083333333,Â¾mol/m_,Model,0.05 arcdegree,Globcolour (Maritorena et al. 2010),2000,NA,NA,2014,NA,NA,maximum value at maximum bottom depth,NA,FALSE,2
Bio-ORACLE,BO2_lightbotmax_bdmean,Light at bottom (maximum at mean depth),Maximum light penetration in the ocean at mean bottom depth,FALSE,TRUE,FALSE,7000,0.083333333,Â¾mol/m_,satellite imagery,0.05 arcdegree,Globcolour (Maritorena et al. 2010),2000,NA,NA,2014,NA,NA,maximum value at mean bottom depth,NA,FALSE,2
Bio-ORACLE,BO2_lightbotmax_bdmin,Light at bottom (maximum at min depth),Maximum light penetration in the ocean at mean bottom depth,FALSE,TRUE,FALSE,7000,0.083333333,Â¾mol/m_,satellite imagery,0.05 arcdegree,Globcolour (Maritorena et al. 2010),2000,NA,NA,2014,NA,NA,maximum value at minimum bottom depth,NA,FALSE,2
Bio-ORACLE,BO2_lightbotmean_bdmax,Light at bottom (mean at max depth),Mean light penetration in the ocean at maximum bottom depth,FALSE,TRUE,FALSE,7000,0.083333333,Â¾mol/m_,satellite imagery,0.05 arcdegree,Globcolour (Maritorena et al. 2010),2000,NA,NA,2014,NA,NA,mean value at maximum bottom depth,NA,FALSE,2
Bio-ORACLE,BO2_lightbotmean_bdmean,Light at bottom (mean at mean depth),Mean light penetration in the ocean at mean bottom depth,FALSE,TRUE,FALSE,7000,0.083333333,Â¾mol/m_,satellite imagery,0.05 arcdegree,Globcolour (Maritorena et al. 2010),2000,NA,NA,2014,NA,NA,mean value at mean bottom depth,NA,FALSE,2
Bio-ORACLE,BO2_lightbotmean_bdmin,Light at bottom (mean at min depth),Mean light penetration in the ocean at minimum bottom depth,FALSE,TRUE,FALSE,7000,0.083333333,Â¾mol/m_,satellite imagery,0.05 arcdegree,Globcolour (Maritorena et al. 2010),2000,NA,NA,2014,NA,NA,mean value at minimum bottom depth,NA,FALSE,2
Bio-ORACLE,BO2_lightbotmin_bdmax,Light at bottom (minimum at max depth),Minimum light penetration in the ocean at maximum bottom depth,FALSE,TRUE,FALSE,7000,0.083333333,Â¾mol/m_,satellite imagery,0.05 arcdegree,Globcolour (Maritorena et al. 2010),2000,NA,NA,2014,NA,NA,minimum value at maximum bottom depth,NA,FALSE,2
Bio-ORACLE,BO2_lightbotmin_bdmean,Light at bottom (minimum at mean depth),Minimum light penetration in the ocean at mean bottom depth,FALSE,TRUE,FALSE,7000,0.083333333,Â¾mol/m_,satellite imagery,0.05 arcdegree,Globcolour (Maritorena et al. 2010),2000,NA,NA,2014,NA,NA,minimum value at mean bottom depth,NA,FALSE,2
Bio-ORACLE,BO2_lightbotmin_bdmin,Light at bottom (minimum at min depth),Minimum light penetration in the ocean at minimum bottom depth,FALSE,TRUE,FALSE,7000,0.083333333,Â¾mol/m_,satellite imagery,0.05 arcdegree,Globcolour (Maritorena et al. 2010),2000,NA,NA,2014,NA,NA,minimum value at minimum bottom depth,NA,FALSE,2
Bio-ORACLE,BO2_lightbotrange_bdmax,Light at bottom (range at max depth),Range of the light penetration in the ocean at maximum bottom depth,FALSE,TRUE,FALSE,7000,0.083333333,Â¾mol/m_,satellite imagery,0.05 arcdegree,Globcolour (Maritorena et al. 2010),2000,NA,NA,2014,NA,NA,range at maximum bottom depth,NA,FALSE,2
Bio-ORACLE,BO2_lightbotrange_bdmean,Light at bottom (range at mean depth),Range of the light penetration in the ocean at mean bottom depth,FALSE,TRUE,FALSE,7000,0.083333333,Â¾mol/m_,satellite imagery,0.05 arcdegree,Globcolour (Maritorena et al. 2010),2000,NA,NA,2014,NA,NA,range at mean bottom depth,NA,FALSE,2
Bio-ORACLE,BO2_lightbotrange_bdmin,Light at bottom (range at min depth),Range of the light penetration in the ocean at minimum bottom depth,FALSE,TRUE,FALSE,7000,0.083333333,Â¾mol/m_,satellite imagery,0.05 arcdegree,Globcolour (Maritorena et al. 2010),2000,NA,NA,2014,NA,NA,range at minimum bottom depth,NA,FALSE,2
Bio-ORACLE,BO2_lightbotltmax_bdmax,Light at bottom (longterm max at max depth),Longterm maximum light penetration in the ocean at maximum bottom depth,FALSE,TRUE,FALSE,7000,0.083333333,Â¾mol/m_,satellite imagery,0.05 arcdegree,Globcolour (Maritorena et al. 2010),2000,NA,NA,2014,NA,NA,long term maximum value at maximum bottom depth,NA,FALSE,2
Bio-ORACLE,BO2_lightbotltmax_bdmean,Light at bottom (longterm max at mean depth),Longterm maximum light penetration in the ocean at mean bottom depth,FALSE,TRUE,FALSE,7000,0.083333333,Â¾mol/m_,satellite imagery,0.05 arcdegree,Globcolour (Maritorena et al. 2010),2000,NA,NA,2014,NA,NA,long term maximum value at mean bottom depth,NA,FALSE,2
Bio-ORACLE,BO2_lightbotltmax_bdmin,Light at bottom (longterm max at min depth),Longterm maximum light penetration in the ocean at minimum bottom depth,FALSE,TRUE,FALSE,7000,0.083333333,Â¾mol/m_,satellite imagery,0.05 arcdegree,Globcolour (Maritorena et al. 2010),2000,NA,NA,2014,NA,NA,long term maximum value at minimum bottom depth,NA,FALSE,2
Bio-ORACLE,BO2_lightbotltmin_bdmax,Light at bottom (longterm min at max depth),Longterm minimum light penetration in the ocean at maximum bottom depth,FALSE,TRUE,FALSE,7000,0.083333333,Â¾mol/m_,satellite imagery,0.05 arcdegree,Globcolour (Maritorena et al. 2010),2000,NA,NA,2014,NA,NA,long term minimum value at maximum bottom depth,NA,FALSE,2
Bio-ORACLE,BO2_lightbotltmin_bdmean,Light at bottom (longterm max at mean depth),Longterm minimum light penetration in the ocean at mean bottom depth,FALSE,TRUE,FALSE,7000,0.083333333,Â¾mol/m_,satellite imagery,0.05 arcdegree,Globcolour (Maritorena et al. 2010),2000,NA,NA,2014,NA,NA,long term minimum value at mean bottom depth,NA,FALSE,2
Bio-ORACLE,BO2_lightbotltmin_bdmin,Light at bottom (longterm min at min depth),Longterm minimum light penetration in the ocean at minimum bottom depth,FALSE,TRUE,FALSE,7000,0.083333333,Â¾mol/m_,satellite imagery,0.05 arcdegree,Globcolour (Maritorena et al. 2010),2000,NA,NA,2014,NA,NA,long term minimum value at minimum bottom depth,NA,FALSE,2
Bio-ORACLE,BO2_nitratemax_bdmax,Nitrate concentration (maximum at max depth),Maximum mole concentration of nitrate in sea water at maximum bottom depth,FALSE,TRUE,FALSE,7000,0.083333333,Â¾mol/m,Model,0.25 arcdegree,Global Ocean Biogeochemistry NON ASSIMILATIVE Hindcast (PISCES) URL: http://marine.copernicus.eu/,2000,NA,NA,2014,NA,NA,maximum value at maximum bottom depth,NA,FALSE,2
Bio-ORACLE,BO2_nitratemax_bdmean,Nitrate concentration (maximum at mean depth),Maximum mole concentration of nitrate in sea water at mean bottom depth,FALSE,TRUE,FALSE,7000,0.083333333,Â¾mol/m,Model,0.25 arcdegree,Global Ocean Biogeochemistry NON ASSIMILATIVE Hindcast (PISCES) URL: http://marine.copernicus.eu/,2000,NA,NA,2014,NA,NA,maximum value at mean bottom depth,NA,FALSE,2
Bio-ORACLE,BO2_nitratemax_bdmin,Nitrate concentration (maximum at min depth),Maximum mole concentration of nitrate in sea water at mean bottom depth,FALSE,TRUE,FALSE,7000,0.083333333,Â¾mol/m,Model,0.25 arcdegree,Global Ocean Biogeochemistry NON ASSIMILATIVE Hindcast (PISCES) URL: http://marine.copernicus.eu/,2000,NA,NA,2014,NA,NA,maximum value at minimum bottom depth,NA,FALSE,2
Bio-ORACLE,BO2_nitratemean_bdmax,Nitrate concentration (mean at max depth),Mean mole concentration of nitrate in sea water at maximum bottom depth,FALSE,TRUE,FALSE,7000,0.083333333,Â¾mol/m,Model,0.25 arcdegree,Global Ocean Biogeochemistry NON ASSIMILATIVE Hindcast (PISCES) URL: http://marine.copernicus.eu/,2000,NA,NA,2014,NA,NA,mean value at maximum bottom depth,NA,FALSE,2
Bio-ORACLE,BO2_nitratemean_bdmean,Nitrate concentration (mean at mean depth),Mean mole concentration of nitrate in sea water at mean bottom depth,FALSE,TRUE,FALSE,7000,0.083333333,Â¾mol/m,Model,0.25 arcdegree,Global Ocean Biogeochemistry NON ASSIMILATIVE Hindcast (PISCES) URL: http://marine.copernicus.eu/,2000,NA,NA,2014,NA,NA,mean value at mean bottom depth,NA,FALSE,2
Bio-ORACLE,BO2_nitratemean_bdmin,Nitrate concentration (mean at min depth),Mean mole concentration of nitrate in sea water at minimum bottom depth,FALSE,TRUE,FALSE,7000,0.083333333,Â¾mol/m,Model,0.25 arcdegree,Global Ocean Biogeochemistry NON ASSIMILATIVE Hindcast (PISCES) URL: http://marine.copernicus.eu/,2000,NA,NA,2014,NA,NA,mean value at minimum bottom depth,NA,FALSE,2
Bio-ORACLE,BO2_nitratemin_bdmax,Nitrate concentration (minimum at max depth),Minimum mole concentration of nitrate in sea water at maximum bottom depth,FALSE,TRUE,FALSE,7000,0.083333333,Â¾mol/m,Model,0.25 arcdegree,Global Ocean Biogeochemistry NON ASSIMILATIVE Hindcast (PISCES) URL: http://marine.copernicus.eu/,2000,NA,NA,2014,NA,NA,minimum value at maximum bottom depth,NA,FALSE,2
Bio-ORACLE,BO2_nitratemin_bdmean,Nitrate concentration (minimum at mean depth),Minimum mole concentration of nitrate in sea water at mean bottom depth,FALSE,TRUE,FALSE,7000,0.083333333,Â¾mol/m,Model,0.25 arcdegree,Global Ocean Biogeochemistry NON ASSIMILATIVE Hindcast (PISCES) URL: http://marine.copernicus.eu/,2000,NA,NA,2014,NA,NA,minimum value at mean bottom depth,NA,FALSE,2
Bio-ORACLE,BO2_nitratemin_bdmin,Nitrate concentration (minimum at min depth),Minimum mole concentration of nitrate in sea water at minimum bottom depth,FALSE,TRUE,FALSE,7000,0.083333333,Â¾mol/m,Model,0.25 arcdegree,Global Ocean Biogeochemistry NON ASSIMILATIVE Hindcast (PISCES) URL: http://marine.copernicus.eu/,2000,NA,NA,2014,NA,NA,minimum value at minimum bottom depth,NA,FALSE,2
Bio-ORACLE,BO2_nitraterange_bdmax,Nitrate concentration (range at max depth),Range of the mole concentration of nitrate in sea water at maximum bottom depth,FALSE,TRUE,FALSE,7000,0.083333333,Â¾mol/m,Model,0.25 arcdegree,Global Ocean Biogeochemistry NON ASSIMILATIVE Hindcast (PISCES) URL: http://marine.copernicus.eu/,2000,NA,NA,2014,NA,NA,range at maximum bottom depth,NA,FALSE,2
Bio-ORACLE,BO2_nitraterange_bdmean,Nitrate concentration (range at mean depth),Range of the mole concentration of nitrate in sea water at mean bottom depth,FALSE,TRUE,FALSE,7000,0.083333333,Â¾mol/m,Model,0.25 arcdegree,Global Ocean Biogeochemistry NON ASSIMILATIVE Hindcast (PISCES) URL: http://marine.copernicus.eu/,2000,NA,NA,2014,NA,NA,range at mean bottom depth,NA,FALSE,2
Bio-ORACLE,BO2_nitraterange_bdmin,Nitrate concentration (range at min depth),Range of the mole concentration of nitrate in sea water at minimum bottom depth,FALSE,TRUE,FALSE,7000,0.083333333,Â¾mol/m,Model,0.25 arcdegree,Global Ocean Biogeochemistry NON ASSIMILATIVE Hindcast (PISCES) URL: http://marine.copernicus.eu/,2000,NA,NA,2014,NA,NA,range at minimum bottom depth,NA,FALSE,2
Bio-ORACLE,BO2_nitrateltmax_bdmax,Nitrate concentration (longterm max at max depth),Longterm maximum mole concentration of nitrate in sea water at maximum bottom depth,FALSE,TRUE,FALSE,7000,0.083333333,Â¾mol/m,Model,0.25 arcdegree,Global Ocean Biogeochemistry NON ASSIMILATIVE Hindcast (PISCES) URL: http://marine.copernicus.eu/,2000,NA,NA,2014,NA,NA,long term maximum value at maximum bottom depth,NA,FALSE,2
Bio-ORACLE,BO2_nitrateltmax_bdmean,Nitrate concentration (longterm max at mean depth),Longterm maximum mole concentration of nitrate in sea water at mean bottom depth,FALSE,TRUE,FALSE,7000,0.083333333,Â¾mol/m,Model,0.25 arcdegree,Global Ocean Biogeochemistry NON ASSIMILATIVE Hindcast (PISCES) URL: http://marine.copernicus.eu/,2000,NA,NA,2014,NA,NA,long term maximum value at mean bottom depth,NA,FALSE,2
Bio-ORACLE,BO2_nitrateltmax_bdmin,Nitrate concentration (longterm max at min depth),Longterm maximum mole concentration of nitrate in sea water at minimum bottom depth,FALSE,TRUE,FALSE,7000,0.083333333,Â¾mol/m,Model,0.25 arcdegree,Global Ocean Biogeochemistry NON ASSIMILATIVE Hindcast (PISCES) URL: http://marine.copernicus.eu/,2000,NA,NA,2014,NA,NA,long term maximum value at minimum bottom depth,NA,FALSE,2
Bio-ORACLE,BO2_nitrateltmin_bdmax,Nitrate concentration (longterm min at max depth),Longterm minimum mole concentration of nitrate in sea water at maximum bottom depth,FALSE,TRUE,FALSE,7000,0.083333333,Â¾mol/m,Model,0.25 arcdegree,Global Ocean Biogeochemistry NON ASSIMILATIVE Hindcast (PISCES) URL: http://marine.copernicus.eu/,2000,NA,NA,2014,NA,NA,long term minimum value at maximum bottom depth,NA,FALSE,2
Bio-ORACLE,BO2_nitrateltmin_bdmean,Nitrate concentration (longterm max at mean depth),Longterm minimum mole concentration of nitrate in sea water at mean bottom depth,FALSE,TRUE,FALSE,7000,0.083333333,Â¾mol/m,Model,0.25 arcdegree,Global Ocean Biogeochemistry NON ASSIMILATIVE Hindcast (PISCES) URL: http://marine.copernicus.eu/,2000,NA,NA,2014,NA,NA,long term minimum value at mean bottom depth,NA,FALSE,2
Bio-ORACLE,BO2_nitrateltmin_bdmin,Nitrate concentration (longterm min at min depth),Longterm minimum mole concentration of nitrate in sea water at minimum bottom depth,FALSE,TRUE,FALSE,7000,0.083333333,Â¾mol/m,Model,0.25 arcdegree,Global Ocean Biogeochemistry NON ASSIMILATIVE Hindcast (PISCES) URL: http://marine.copernicus.eu/,2000,NA,NA,2014,NA,NA,long term minimum value at minimum bottom depth,NA,FALSE,2
Bio-ORACLE,BO2_tempmax_bdmax,Sea water temperature (maximum at max depth),Maximum sea water temperature at the bottom at maximum bottom depth,FALSE,TRUE,FALSE,7000,0.083333333,degrees Celcius,Model,0.25 arcdegree,Global Ocean Physics Reanalysis ECMWF ORAP5.0 (1979-2013) URL: http://marine.copernicus.eu/,2000,NA,NA,2014,NA,NA,maximum value at maximum bottom depth,NA,FALSE,2
Bio-ORACLE,BO2_tempmax_bdmean,Sea water temperature (maximum at mean depth),Maximum sea water temperature at the bottom at mean bottom depth,FALSE,TRUE,FALSE,7000,0.083333333,degrees Celcius,Model,0.25 arcdegree,Global Ocean Physics Reanalysis ECMWF ORAP5.0 (1979-2013) URL: http://marine.copernicus.eu/,2000,NA,NA,2014,NA,NA,maximum value at mean bottom depth,NA,FALSE,2
Bio-ORACLE,BO2_tempmax_bdmin,Sea water temperature (maximum at min depth),Maximum sea water temperature at the bottom at mean bottom depth,FALSE,TRUE,FALSE,7000,0.083333333,degrees Celcius,Model,0.25 arcdegree,Global Ocean Physics Reanalysis ECMWF ORAP5.0 (1979-2013) URL: http://marine.copernicus.eu/,2000,NA,NA,2014,NA,NA,maximum value at minimum bottom depth,NA,FALSE,2
Bio-ORACLE,BO2_tempmean_bdmax,Sea water temperature (mean at max depth),Mean sea water temperature at the bottom at maximum bottom depth,FALSE,TRUE,FALSE,7000,0.083333333,degrees Celcius,Model,0.25 arcdegree,Global Ocean Physics Reanalysis ECMWF ORAP5.0 (1979-2013) URL: http://marine.copernicus.eu/,2000,NA,NA,2014,NA,NA,mean value at maximum bottom depth,NA,FALSE,2
Bio-ORACLE,BO2_tempmean_bdmean,Sea water temperature (mean at mean depth),Mean sea water temperature at the bottom at mean bottom depth,FALSE,TRUE,FALSE,7000,0.083333333,degrees Celcius,Model,0.25 arcdegree,Global Ocean Physics Reanalysis ECMWF ORAP5.0 (1979-2013) URL: http://marine.copernicus.eu/,2000,NA,NA,2014,NA,NA,mean value at mean bottom depth,NA,FALSE,2
Bio-ORACLE,BO2_tempmean_bdmin,Sea water temperature (mean at min depth),Mean sea water temperature at the bottom at minimum bottom depth,FALSE,TRUE,FALSE,7000,0.083333333,degrees Celcius,Model,0.25 arcdegree,Global Ocean Physics Reanalysis ECMWF ORAP5.0 (1979-2013) URL: http://marine.copernicus.eu/,2000,NA,NA,2014,NA,NA,mean value at minimum bottom depth,NA,FALSE,2
Bio-ORACLE,BO2_tempmin_bdmax,Sea water temperature (minimum at max depth),Minimum sea water temperature at the bottom at maximum bottom depth,FALSE,TRUE,FALSE,7000,0.083333333,degrees Celcius,Model,0.25 arcdegree,Global Ocean Physics Reanalysis ECMWF ORAP5.0 (1979-2013) URL: http://marine.copernicus.eu/,2000,NA,NA,2014,NA,NA,minimum value at maximum bottom depth,NA,FALSE,2
Bio-ORACLE,BO2_tempmin_bdmean,Sea water temperature (minimum at mean depth),Minimum sea water temperature at the bottom at mean bottom depth,FALSE,TRUE,FALSE,7000,0.083333333,degrees Celcius,Model,0.25 arcdegree,Global Ocean Physics Reanalysis ECMWF ORAP5.0 (1979-2013) URL: http://marine.copernicus.eu/,2000,NA,NA,2014,NA,NA,minimum value at mean bottom depth,NA,FALSE,2
